{
  "$schema": "https://json-schema.org/draft/2020-12/schema",
  "$id": "talent_tree.schema.json",
  "title": "Talent tree",
  "type": "object",
  "additionalProperties": false,
  "required": [
    "tree_id",
    "kind",
    "owner",
    "points",
    "status",
    "nodes"
  ],
  "properties": {
    "tree_id": {
      "$ref": "common.schema.json#/$defs/id"
    },
    "kind": {
      "enum": [
        "class",
        "spec",
        "pvp"
      ]
    },
    "owner": {
      "type": "string",
      "description": "Class id for class trees; spec id for spec and pvp trees."
    },
    "points": {
      "type": "integer",
      "minimum": 1,
      "description": "Points to spend (class and spec trees) or slots (pvp)."
    },
    "gates": {
      "type": "array",
      "items": {
        "type": "integer",
        "minimum": 1
      }
    },
    "status": {
      "$ref": "common.schema.json#/$defs/status"
    },
    "nodes": {
      "type": "array",
      "minItems": 1,
      "items": {
        "type": "object",
        "additionalProperties": false,
        "required": [
          "id",
          "name",
          "type"
        ],
        "properties": {
          "id": {
            "$ref": "common.schema.json#/$defs/id"
          },
          "name": {
            "type": "string"
          },
          "description": {
            "type": "string"
          },
          "type": {
            "enum": [
              "passive",
              "active",
              "choice",
              "capstone"
            ]
          },
          "ranks": {
            "type": "integer",
            "minimum": 1,
            "maximum": 3,
            "default": 1
          },
          "pos": {
            "type": "array",
            "items": {
              "type": "integer",
              "minimum": 0
            },
            "minItems": 2,
            "maxItems": 2,
            "description": "[column, row] on the talent screen. Not used for pvp talents."
          },
          "gate": {
            "type": "integer",
            "minimum": 0,
            "default": 0,
            "description": "Points that must be spent in this tree first. 0 or one of the tree's gates."
          },
          "requires_any": {
            "type": "array",
            "items": {
              "type": "string"
            },
            "description": "Node ids; at least one must be fully ranked. Empty means a root node. May also name an ability id granted elsewhere."
          },
          "grants_ability": {
            "type": "string"
          },
          "choices": {
            "type": "array",
            "minItems": 2,
            "maxItems": 2,
            "items": {
              "type": "object",
              "additionalProperties": false,
              "required": [
                "id",
                "name"
              ],
              "properties": {
                "id": {
                  "$ref": "common.schema.json#/$defs/id"
                },
                "name": {
                  "type": "string"
                },
                "grants_ability": {
                  "type": "string"
                },
                "effects": {
                  "$ref": "#/$defs/effects"
                },
                "grants_aura": {
                  "type": "string"
                },
                "icon": {
                  "type": "object",
                  "additionalProperties": false,
                  "required": [
                    "image"
                  ],
                  "properties": {
                    "image": {
                      "type": "string",
                      "pattern": "^[a-z0-9-]+/[a-z0-9-]+$",
                      "description": "game-icons.net glyph '<author>/<name>' (see ability icons)."
                    },
                    "school": {
                      "$ref": "common.schema.json#/$defs/school"
                    }
                  }
                },
                "description": {
                  "type": "string"
                }
              }
            }
          },
          "effects": {
            "$ref": "#/$defs/effects"
          },
          "grants_aura": {
            "type": "string",
            "description": "Aura id applied to the player for the whole match (a permanent passive; usually hidden from the HUD). Effects may then change its numbers."
          },
          "icon": {
            "type": "object",
            "additionalProperties": false,
            "required": [
              "image"
            ],
            "properties": {
              "image": {
                "type": "string",
                "pattern": "^[a-z0-9-]+/[a-z0-9-]+$",
                "description": "game-icons.net glyph '<author>/<name>' (see ability icons)."
              },
              "school": {
                "$ref": "common.schema.json#/$defs/school"
              }
            }
          }
        },
        "allOf": [
          {
            "if": {
              "properties": {
                "type": {
                  "const": "choice"
                }
              }
            },
            "then": {
              "required": [
                "choices"
              ]
            }
          },
          {
            "if": {
              "properties": {
                "type": {
                  "const": "active"
                }
              }
            },
            "then": {
              "required": [
                "grants_ability"
              ]
            }
          }
        ]
      }
    }
  },
  "$defs": {
    "effects": {
      "type": "array",
      "items": {
        "type": "object",
        "additionalProperties": false,
        "required": [
          "modify"
        ],
        "properties": {
          "modify": {
            "type": "string",
            "description": "<ability or aura id>.<field path>, e.g. ruin_strike.cooldown_s"
          },
          "per_rank": {
            "type": "number"
          },
          "set": {}
        }
      }
    }
  }
}
