{
  "tree_id": "arcanist_rime",
  "kind": "spec",
  "owner": "arcanist_rime",
  "points": 30,
  "status": "draft",
  "nodes": [
    {
      "id": "arcanist_rime_placeholder",
      "name": "Placeholder",
      "type": "passive",
      "effects": [
        {
          "modify": "self.max_health",
          "per_rank": 0
        }
      ],
      "pos": [
        3,
        0
      ]
    }
  ],
  "gates": [
    8,
    20
  ]
}
